<?xml version="1.0" encoding="UTF-8" ?>
<!DOCTYPE srcs SYSTEM "srcs.dtd">

<srcs>
  <src name="test">
    <description>Nifty new test for dynamic compilation and loading</description>
    <lib name="Core_Datatypes"/>
    <libpath name="../../../../lib"/>
    <inc name="/usr/local/bogusdir/include"/>
  </src>
   <src name="boo">
    <description>Nifty new test for dynamic compilation and loading</description>
    <lib name="Core_Datatypes"/>
    <libpath name="../../../../lib"/>
    <inc name="/usr/local/boodir/include"/>
  </src> 
</srcs>


